{
  "version": 2,
  "projects_dir": "projects",
  "krita_template": "templates/krita/instagram-portrait.ora",
  "workflow_policy": {
    "generator": "comfy",
    "finisher": "krita",
    "image_text_policies": ["textless", "krita-text"],
    "allow_automated_krita_lettering": true,
    "krita_text_layers": ["\u6587\u5b57", "\u30d5\u30ad\u30c0\u30b7"],
    "allow_external_selected_images": false,
    "require_comfy_png_metadata": true,
    "require_textless_generation_prompt": true,
    "require_krita_source": true,
    "krita_manuscript_format": "kra",
    "require_krita_export": true,
    "require_visual_review_receipt": true,
    "ready_episode_statuses": ["ready", "complete", "published"],
    "required_comfy_node_types": [
      "CheckpointLoaderSimple",
      "CLIPTextEncode",
      "KSampler",
      "VAEDecode",
      "SaveImage"
    ]
  },
  "comfy": {
    "server": "http://127.0.0.1:8188",
    "workflow": "templates/comfy/panel_txt2img_api.json",
    "width": 768,
    "height": 1024,
    "steps": 24,
    "cfg": 6.5,
    "sampler": "dpmpp_2m",
    "scheduler": "karras",
    "checkpoint": "v1-5-pruned-emaonly-fp16.safetensors",
    "negative_prompt": "low quality, blurry, bad anatomy, extra fingers, malformed hands, duplicate, text, letters, speech bubble, logo, watermark"
  }
}
